{"authorization_id":"build-04-demo-auth-a5a8f11b94784a60","authorization_sha256":"f609fa99ae0280987e11a3328e04d26484c15a65f72a0266566f2aaa9f650b2d","boundaries":{"authorization_consumed":true,"demo_policy_promoted":false,"derived_view_uses_xy":true,"execution_performed":true,"production_activated":false,"raw_attributes_disclosed":false,"raw_geographic_coordinates_disclosed":false,"runtime_wired":false,"source_mutated":false,"source_read_only":true,"source_z_preserved":true},"consumption_record":{"artifact_sha256":"9131df533365e2f42e01edb8988804b850b65e69b932c55b672e0addd3400d84","authorization_id":"build-04-demo-auth-a5a8f11b94784a60","authorization_sha256":"f609fa99ae0280987e11a3328e04d26484c15a65f72a0266566f2aaa9f650b2d","consumption_id":"build-05-consumption-f609fa99ae0280987e11a332","consumption_schema":"nma.build-demo-authorization-consumption/1.0","consumption_sha256":"44ab99947d9cb196de6a4f5a5238b4af33eb306a911a104224774425c7ebb108","execution_id":"build-05-demo-exec-b8b5ecd54954b190eb8cda39","idempotency_key_sha256":"61adf89dd58741cd582af47b6edaa6b9470b66c975e3b8dbe23e44da32462355","plan_sha256":"b8b5ecd54954b190eb8cda398710039f334e8424fd0969816380b4a2b52b0b71","replay_allowed":false,"status":"consumed-once"},"demo_artifact":{"artifact_schema":"nma.build-derived-maplibre-demo/1.0","artifact_sha256":"9131df533365e2f42e01edb8988804b850b65e69b932c55b672e0addd3400d84","authorization_id":"build-04-demo-auth-a5a8f11b94784a60","authorization_sha256":"f609fa99ae0280987e11a3328e04d26484c15a65f72a0266566f2aaa9f650b2d","boundaries":{"derived_view_uses_xy":true,"production_activated":false,"runtime_wired":false,"source_accessed_read_only":true,"source_mutated":false,"source_z_preserved":true},"execution_id":"build-05-demo-exec-b8b5ecd54954b190eb8cda39","feature_reference":"build-feature:sha256:14ea3d0010f07e672ba549bd9a1963eec97f5029cbb68e3aea6cc908b241801f","maplibre_demo":{"controls":{"hatch_angle_degrees":{"default":45.0,"demo_only":true,"maximum_exclusive":180.0,"minimum_inclusive":0.0,"step":1.0,"user_adjustable":true}},"source":{"data":{"features":[{"geometry":{"coordinates":[[[1.0,0.57354],[0.999044,0.472806],[0.998662,0.432269],[0.997611,0.321476],[0.995761,0.126029],[0.993777,0.126045],[0.992432,0.028617],[0.989113,0.020178],[0.985149,0.01352],[0.977604,0.007368],[0.96936,0.003845],[0.962746,0.003113],[0.963244,0.06796],[0.951396,0.068169],[0.951631,0.086809],[0.914702,0.087223],[0.914789,0.068811],[0.898326,0.069102],[0.898816,0.004127],[0.861147,0.003884],[0.788803,0.00342],[0.761554,0.003245],[0.649625,0.002526],[0.607802,0.002257],[0.559258,0.001945],[0.528918,0.001838],[0.474861,0.001652],[0.367629,0.001279],[0.000344,0.0],[0.000325,0.006444],[0.000239,0.037832],[0.0,0.124272],[0.032531,0.124661],[0.05069,0.12488],[0.050722,0.126575],[0.35529,0.126971],[0.355387,0.150991],[0.357078,0.15096],[0.383654,0.150459],[0.383238,0.089409],[0.455609,0.089915],[0.455298,0.150646],[0.483503,0.150389],[0.48373,0.126857],[0.528918,0.126775],[0.617277,0.126613],[0.790202,0.127241],[0.79045,0.059471],[0.79051,0.04319],[0.822301,0.043359],[0.822116,0.036312],[0.856205,0.035702],[0.857161,0.061577],[0.822803,0.062453],[0.822694,0.058321],[0.808951,0.058504],[0.808958,0.059352],[0.809475,0.124957],[0.871557,0.124736],[0.871876,0.161938],[0.872419,0.225074],[0.872536,0.238515],[0.873248,0.321476],[0.875439,0.576045],[1.0,0.57354]]],"type":"Polygon"},"id":"build-feature:sha256:14ea3d0010f07e672ba549bd9a1963eec97f5029cbb68e3aea6cc908b241801f","properties":{"annotation_value_sha256":"17460f383142153fa58b587a2d3902b6cdbbcddb663d151cf28ce86bc6149a52","display_annotation":"樓層＋結構","feature_code":"9310100"},"type":"Feature"}],"type":"FeatureCollection"},"type":"geojson"},"style":{"annotation":{"anchor_policy":"polygon-pole-of-inaccessibility","collision_policy":"suppress-if-no-interior-fit-or-higher-priority-collision","outside_displacement_allowed":false},"boundary":{"color":"#111111","opacity":1.0,"style":"solid","width_css_px":1.0},"hatch":{"angle_degrees":45.0,"clip_to_feature_geometry":true,"color":"#111111","pattern_id":"nma-building-hatch-demo","spacing_css_px":"7.559055118110236"},"profile_id":"nma-maplibre-web-demo-v1"}},"privacy":{"annotation_value_included":false,"coordinate_space":"normalized-local-demo-not-geographic","derived_normalized_shape_included":true,"raw_attributes_included":false,"raw_geographic_coordinates_included":false},"resolution_sha256":"a5a8f11b94784a6065d7b75e151207126506c85ce826dd526c2c8f4802ba8b01","source_commitments":{"attribute_commitment_sha256":"ddfa112586b9c2bc3a61bdf2638b7994ba1200bfce5d8ad34988f2a24da96078","geometry_commitment_sha256":"23f7d5adacfb468bf0105ed66bb6f64ac44b50e22c47a2399a4787f6051bb22f","source_geometry_type":"PolygonZ","source_ring_count":1,"source_vertex_count":65},"status":"rendered-derived-demo"},"execution_id":"build-05-demo-exec-b8b5ecd54954b190eb8cda39","package_sha256":"10c22339abb8d2eed489ae56a54214948213bad51a135e00f74e309931c98c97","package_version":"build-05/1.0","plan_sha256":"b8b5ecd54954b190eb8cda398710039f334e8424fd0969816380b4a2b52b0b71","receipt":{"artifact_sha256":"9131df533365e2f42e01edb8988804b850b65e69b932c55b672e0addd3400d84","authorization_id":"build-04-demo-auth-a5a8f11b94784a60","authorization_sha256":"f609fa99ae0280987e11a3328e04d26484c15a65f72a0266566f2aaa9f650b2d","boundaries":{"authorization_consumed":true,"demo_policy_promoted":false,"derived_view_uses_xy":true,"execution_performed":true,"production_activated":false,"raw_attributes_disclosed":false,"raw_geographic_coordinates_disclosed":false,"runtime_wired":false,"source_mutated":false,"source_read_only":true,"source_z_preserved":true},"consumption_sha256":"44ab99947d9cb196de6a4f5a5238b4af33eb306a911a104224774425c7ebb108","execution_id":"build-05-demo-exec-b8b5ecd54954b190eb8cda39","outcome":"success-derived-demo-only","plan_sha256":"b8b5ecd54954b190eb8cda398710039f334e8424fd0969816380b4a2b52b0b71","receipt_id":"build-05-receipt-b8b5ecd54954b190eb8cda39","receipt_schema":"nma.build-demo-execution-receipt/1.0","receipt_sha256":"c4ff4017c01aa3ef861530a91204fcd8357387a8400f4a47fcd637033f445573","resolution_sha256":"a5a8f11b94784a6065d7b75e151207126506c85ce826dd526c2c8f4802ba8b01","source_verification":{"archive_sha256_after":"4888dbf9a838ed5c41e20c3b528c542c7e52845b4d8e4809f58ea5afcec2da53","archive_sha256_before":"4888dbf9a838ed5c41e20c3b528c542c7e52845b4d8e4809f58ea5afcec2da53","attribute_commitment_sha256":"ddfa112586b9c2bc3a61bdf2638b7994ba1200bfce5d8ad34988f2a24da96078","geometry_commitment_sha256":"23f7d5adacfb468bf0105ed66bb6f64ac44b50e22c47a2399a4787f6051bb22f"}},"resolution_sha256":"a5a8f11b94784a6065d7b75e151207126506c85ce826dd526c2c8f4802ba8b01","schema_version":"nma.build-demo-execution-package/1.0"}
